<?xml version="1.0" encoding="UTF-8"?>
<Components xmlns:xsi="http://www.w3.org/2001/XMLSchema-instance" xsi:noNamespaceSchemaLocation="Components.xsd">
	<FieldTKG fvt="PERSON" fgg="JGRP1" page.layout="WEB" />
	<Heading SECTION="WEBC01" size="H1" emphasis="INFO" alignment="LEFT">
		<Title>Title</Title>
		<Text>Contact Information</Text>
		<SubText>Including address</SubText>
	</Heading>
	<Panel SECTION="WEBC01" type="DEFAULT">
		<Collection>
			<PanelHeader>
				<Collection>
					<Heading size="H5" emphasis="INFO" alignment="LEFT">
						<Text>Header Information</Text>
					</Heading>
				</Collection>
			</PanelHeader>
			<PanelBody>
				<Collection>
					<FieldSet enabled="true">
						<Collection>
							<Row>
								<Column size="SM_4">
									<Collection>
										<FormGroup>
											<Collection>
												<FormLabel KEY="FL00_1" isHtml="false" />
												<Input KEY="FV00_1" type="TEXT" />
											</Collection>
										</FormGroup>
									</Collection>
								</Column>
								<Column size="SM_4">
									<Collection>
										<FormGroup>
											<Collection>
												<FormLabel KEY="FL00_2" isHtml="false" />
												<Input KEY="FV00_2" type="TEXT" />
											</Collection>
										</FormGroup>
									</Collection>
								</Column>
								<Column size="SM_4">
									<Collection>
										<FormGroup>
											<Collection>
												<FormLabel KEY="FL00_3" isHtml="false" />
												<TextBox KEY="FV00_3" />
											</Collection>
										</FormGroup>
									</Collection>
								</Column>
							</Row>
							<FormGroup>
								<Collection>
									<FormLabel KEY="FL00_4" isHtml="false" />
									<DatePicker KEY="FV00_4" />
								</Collection>
							</FormGroup>
							<FormGroup>
								<Collection>
									<FormLabel KEY="FL00_16" isHtml="false" />
									<Typeahead KEY="FV00_16">
										<Lookup loc="RPC" params="BLANK,PROFILE" />
									</Typeahead>
								</Collection>
							</FormGroup>
							<FormGroup>
								<Collection>
									<FormLabel KEY="FL00_22" isHtml="false" />
									<Typeahead KEY="FV00_22">
										<Lookup loc="TABLE" params="BLANK,COMPONENTS" />
									</Typeahead>
								</Collection>
							</FormGroup>
							<FormGroup>
								<Collection>
									<FormLabel KEY="FL00_12" isHtml="false" />
									<ListBox KEY="FV00_12" multipleSelect="false">
										<Lookup loc="TABLE" params="BLANK,GENDER,UNKNOWN" />
									</ListBox>
								</Collection>
							</FormGroup>
						</Collection>
					</FieldSet>
				</Collection>
			</PanelBody>
			<PanelFooter>
				<Collection>
					<Heading color="red" size="H5" emphasis="INFO" alignment="LEFT">
						<Text>Footer</Text>
					</Heading>
				</Collection>
			</PanelFooter>
		</Collection>
	</Panel>
	<Panel SECTION="WEBC01" type="DEFAULT">
		<Collection>
			<PanelHeader>
				<Collection>
					<Heading color="red" size="H5" emphasis="INFO" alignment="LEFT">
						<Text>Address Information</Text>
					</Heading>
				</Collection>
			</PanelHeader>
			<PanelBody>
				<Collection>
					<FieldSet enabled="true">
						<Collection>
							<FormGroup>
								<Collection>
									<FormLabel KEY="FL00_13" isHtml="false">
										<Text>address:</Text>
									</FormLabel>
									<FlexTable KEY="FV00_13" width="100%">
										<Title>Title</Title>
									</FlexTable>
								</Collection>
							</FormGroup>
						</Collection>
					</FieldSet>
				</Collection>
			</PanelBody>
			<PanelFooter>
				<Collection>
					<Heading color="red" size="H5" emphasis="INFO" alignment="LEFT">
						<Text>Footer</Text>
					</Heading>
				</Collection>
			</PanelFooter>
		</Collection>
	</Panel>
	<Icon SECTION="WEBL01" pull="LEFT" type="AMAZON" size="LARGE" border="true" spin="false" pulse="false" inverse="false">
		<Title>Title</Title>
	</Icon>
	<Badge SECTION="WEBR01">
		<Title>Title</Title>
		<Text>Text</Text>
	</Badge>
</Components>