<?xml version="1.0" encoding="UTF-8"?>
<Components xmlns:xsi="http://www.w3.org/2001/XMLSchema-instance" xsi:noNamespaceSchemaLocation="Components.xsd">
	<FieldTKG fvt="PERSON" fgg="PERSON" page.layout="WEB" />
	<Heading SECTION="CENTER_01" size="H1" emphasis="INFO" alignment="LEFT">
		<Title>Title</Title>
		<Text>Contact Information</Text>
		<SubText>Including address</SubText>
	</Heading>
	<Panel SECTION="CENTER_01" type="DEFAULT">
		<Collection>
			<PanelHeader>
				<Collection>
					<Heading size="H5" emphasis="INFO" alignment="LEFT">
						<Text>Header Information</Text>
					</Heading>
				</Collection>
			</PanelHeader>
			<PanelBody>
				<Collection>
					<FieldSet enabled="true">
						<Collection>
							<Row>
								<Column size="SM_4">
									<Collection>
										<FormGroup>
											<Collection>
												<FormLabel KEY="FL00_-4" isHtml="false">
													<Text>first:</Text>
												</FormLabel>
												<Input KEY="FV00_-4" type="TEXT" />
											</Collection>
										</FormGroup>
									</Collection>
								</Column>
								<Column size="SM_4">
									<Collection>
										<FormGroup>
											<Collection>
												<FormLabel KEY="FL00_-6" isHtml="false">
													<Text>middle:</Text>
												</FormLabel>
												<TextBox KEY="FV00_-6" />
											</Collection>
										</FormGroup>
									</Collection>
								</Column>
								<Column size="SM_4">
									<Collection>
										<FormGroup>
											<Collection>
												<FormLabel KEY="FL00_-5" isHtml="false">
													<Text>last:</Text>
												</FormLabel>
												<Input KEY="FV00_-5" type="TEXT" />
											</Collection>
										</FormGroup>
									</Collection>
								</Column>
							</Row>
							<FormGroup>
								<Collection>
									<FormLabel KEY="FL00_-12" isHtml="false">
										<Text>dob:</Text>
									</FormLabel>
									<DatePicker KEY="FV00_-12" />
								</Collection>
							</FormGroup>
							<FormGroup>
								<Collection>
									<FormLabel KEY="FL00_-11" isHtml="false">
										<Text>profile:</Text>
									</FormLabel>
									<Typeahead KEY="FV00_-11">
										<Lookup loc="RPC" params="BLANK,PROFILE" />
									</Typeahead>
								</Collection>
							</FormGroup>
							<FormGroup>
								<Collection>
									<FormLabel KEY="FL00_-8" isHtml="false">
										<Text>page:</Text>
									</FormLabel>
									<Typeahead KEY="FV00_-8">
										<Lookup loc="TABLE" params="BLANK,COMPONENTS" />
									</Typeahead>
								</Collection>
							</FormGroup>
							<FormGroup>
								<Collection>
									<FormLabel KEY="FL00_-7" isHtml="false">
										<Text>gender:</Text>
									</FormLabel>
									<ListBox KEY="FV00_-7" multipleSelect="false">
										<Lookup loc="TABLE" params="BLANK,GENDER,UNKNOWN" />
									</ListBox>
								</Collection>
							</FormGroup>
						</Collection>
					</FieldSet>
				</Collection>
			</PanelBody>
			<PanelFooter>
				<Collection>
					<Heading color="red" size="H5" emphasis="INFO" alignment="LEFT">
						<Text>Footer</Text>
					</Heading>
				</Collection>
			</PanelFooter>
		</Collection>
	</Panel>
	<Icon SECTION="LEFT_01" pull="LEFT" type="AMAZON" size="LARGE" border="true" spin="false" pulse="false" inverse="false">
		<Title>Title</Title>
	</Icon>
	<Badge SECTION="RIGHT_01">
		<Title>Title</Title>
		<Text>Text</Text>
	</Badge>
</Components>